"","X","text","favorited","favoriteCount","replyToSN","created","truncated","replyToSID","id","replyToUID","statusSource","screenName","retweetCount","isRetweet","retweeted","longitude","latitude"
"28",28,"Just dropped this little guy off at the vet. One of the fosters had found it and was much disappointed that they co… https://t.co/J5K9BckWm4",FALSE,0,NA,"2019-06-01 06:56:41",TRUE,NA,1134715373301981184,NA,"<a href=""http://instagram.com"" rel=""nofollow"">Instagram</a>","slvrsft",0,FALSE,FALSE,-76.06483,36.75483
"36",36,"Nothing like besties working at our salon <ed><U+00A0><U+00BD><ed><U+00B8><U+0098>#virginiabeach #colorspecialist #757colorist #757hairstylist @ New Realm… https://t.co/sHUC54n3Cw",FALSE,0,NA,"2019-05-31 23:03:21",TRUE,NA,1134596254837743616,NA,"<a href=""http://instagram.com"" rel=""nofollow"">Instagram</a>","hairwearesalon",0,FALSE,FALSE,-76.0047917,36.7770024
"42",42,"Drink #2",FALSE,0,NA,"2019-05-31 17:06:24",FALSE,NA,1134506426154360832,NA,"<a href=""http://twitter.com/download/iphone"" rel=""nofollow"">Twitter for iPhone</a>","lyricallyloved_",0,FALSE,FALSE,NA,NA
"43",43,"Update:  We have reached 1/2 full!<U+2800>
<U+2800>
The 2nd Annual Iron Asylum Classic is back in the Iron Asylum Gym in Virginia… https://t.co/umAMKubI8r",FALSE,0,NA,"2019-05-31 12:53:11",TRUE,NA,1134442700990832640,NA,"<a href=""http://instagram.com"" rel=""nofollow"">Instagram</a>","jlayne3",1,FALSE,FALSE,-76.03875875,36.77710027
"47",47,"Working on that onion booty. Gonna make the whole <ed><U+00A0><U+00BC><ed><U+00BC><U+008E> cry.... Never really record my workouts but I know it’s good so… https://t.co/Dw5vq7Erf3",FALSE,0,NA,"2019-05-30 17:25:01",TRUE,NA,1134148724261888000,NA,"<a href=""http://instagram.com"" rel=""nofollow"">Instagram</a>","UrSoInShane",0,FALSE,FALSE,-76.03875875,36.77710027
"49",49,"I have to admit that it take a lot of hyping myself up to get out of my car and walk into the gym. Everyone seems t… https://t.co/HlqSwfeGGW",FALSE,0,NA,"2019-05-29 19:26:25",TRUE,NA,1133816886515372032,NA,"<a href=""http://instagram.com"" rel=""nofollow"">Instagram</a>","UrSoInShane",0,FALSE,FALSE,-76.03875875,36.77710027
