"","X","text","favorited","favoriteCount","replyToSN","created","truncated","replyToSID","id","replyToUID","statusSource","screenName","retweetCount","isRetweet","retweeted","longitude","latitude"
"54",54,"May God bless your precious Heroic Soul #KendrickCastillo #HERO <U+2764><ed><U+00A0><U+00BD><ed><U+00B0><U+00BC><ed><U+00A0><U+00BD><ed><U+00B2><U+009B> @ STEM School Highlands Ranch https://t.co/iPDWEFCSLt",FALSE,0,NA,"2019-05-08 18:06:41",FALSE,NA,1126186673245761536,NA,"<a href=""http://instagram.com"" rel=""nofollow"">Instagram</a>","Wiilde",0,FALSE,FALSE,-104.99776,39.55585
"59",59,"Our hearts are heavy <ed><U+00A0><U+00BD><ed><U+00B2><U+0094>
During times like these, we must stand together and support each other and our community. 
P… https://t.co/EMXmbD0tiB",FALSE,0,NA,"2019-05-08 14:35:42",TRUE,NA,1126133581267517440,NA,"<a href=""http://instagram.com"" rel=""nofollow"">Instagram</a>","kavasutrakava",0,FALSE,FALSE,-104.99776,39.55585
"68",68,"Just before our 11 pm newscast, a trio of teens placed a bouquet of flowers &amp; 2 candles in front of STEM School Hig… https://t.co/KU8WlGuKbC",FALSE,0,NA,"2019-05-08 07:30:08",TRUE,NA,1126026482713632768,NA,"<a href=""http://twitter.com/download/iphone"" rel=""nofollow"">Twitter for iPhone</a>","greg_nieto",0,FALSE,FALSE,NA,NA
"90",90,"Stigmatized Property in the US Posted
https://t.co/TWHbm1O7hx",FALSE,0,NA,"2019-05-08 01:31:42",FALSE,NA,1125936280745926656,NA,"<a href=""http://www.oshimaland.co.jp/"" rel=""nofollow"">Oshimaland</a>","Oshimaland",0,FALSE,FALSE,-104.99795528,39.55516125
"104",104,"DougCo Sheriff won’t confirm or deny a fatality in this school shooting. We saw this white tent and red tape on sid… https://t.co/yXGsHSSpHe",FALSE,2,NA,"2019-05-07 23:40:42",TRUE,NA,1125908344605237248,NA,"<a href=""http://twitter.com/download/iphone"" rel=""nofollow"">Twitter for iPhone</a>","MikeKonopasek",4,FALSE,FALSE,NA,NA
"132",132,"A few minutes after 2pm, @dcsheriff reported shots fired at @stemschoolHR, a K-12 school in Highlands Ranch. Dougla… https://t.co/CRiQb2R7wc",FALSE,358,NA,"2019-05-07 21:31:08",TRUE,NA,1125875739469991936,NA,"<a href=""http://twitter.com/download/iphone"" rel=""nofollow"">Twitter for iPhone</a>","LoriLizarraga",298,FALSE,FALSE,NA,NA
"137",137,"NEW: 7, maybe 8 injuries at STEM school, deputies say #DouglasCounty https://t.co/l6gO03jKEB",FALSE,461,NA,"2019-05-07 21:26:19",FALSE,NA,1125874526468878336,NA,"<a href=""http://twitter.com/download/iphone"" rel=""nofollow"">Twitter for iPhone</a>","MikeKonopasek",428,FALSE,FALSE,NA,NA
